influencer_id,platform,date,url,caption,reach,likes,comments
161,Instagram,2025-07-19,http://www.smith.info/,Author program should talk unit newspaper class door.,27780,1696,1358
162,YouTube,2025-06-23,http://www.west.com/,Open rest Democrat than.,184985,27072,5179
96,YouTube,2025-06-17,https://www.bryant-turner.biz/,Particularly answer table.,6819,1036,162
79,Twitter,2025-05-05,https://smith.com/,Alone lay many him.,4280,777,176
211,Twitter,2025-06-08,https://www.hart-lee.com/,Stop approach painting keep.,44469,6491,768
203,Instagram,2025-05-09,https://rodriguez.info/,Theory baby indicate mention range.,44112,8599,1204
181,Instagram,2025-05-14,https://townsend.net/,Police too employee.,70632,13180,862
178,Twitter,2025-07-12,https://freeman.com/,Know behind nation.,27432,1882,442
37,YouTube,2025-07-20,http://www.moore.com/,However security question institution goal fall.,36717,2742,841
176,YouTube,2025-06-05,http://cole.com/,Build probably involve feel ball least.,45253,7077,1078
16,YouTube,2025-06-09,http://pearson.com/,Dinner various paper great inside lose.,38111,7284,1745
178,Twitter,2025-07-11,http://www.west.com/,Glass up top require.,25922,4585,519
276,YouTube,2025-06-15,http://brown.com/,Although challenge serve again although likely expert road.,147406,21411,4721
91,Instagram,2025-06-28,https://www.morgan-barnes.com/,Plan later police.,36709,2524,811
32,Twitter,2025-06-20,https://www.wilson-martinez.com/,Provide recognize majority billion green world individual.,135002,17553,4063
202,YouTube,2025-06-10,https://www.white.com/,Door health social summer apply education trial.,115775,8717,5518
145,Twitter,2025-06-18,https://shelton.com/,Myself daughter forget view college fact yourself.,94630,6920,3439
69,Instagram,2025-06-17,http://walker.com/,Decade carry until beat thought.,53615,8476,1833
186,Twitter,2025-06-16,https://wang-dunn.com/,Child establish crime fact situation raise.,140934,24857,4586
66,Twitter,2025-06-25,https://www.macdonald.com/,Window paper though risk remain kind oil.,22548,3918,251
84,Instagram,2025-06-09,https://www.hurst.org/,Watch fall spring everyone card fear learn.,11580,657,412
88,Instagram,2025-07-19,http://www.jefferson-keller.net/,Pretty attorney arrive nice.,92869,12678,3347
249,YouTube,2025-04-24,http://www.brooks.com/,Ability experience one describe court hear.,45852,7567,1222
65,Instagram,2025-05-12,https://www.sanchez-walker.info/,Suggest glass there learn.,84715,12355,2534
134,Instagram,2025-05-09,https://www.allen-hooper.com/,Reflect defense agent.,94970,13682,2050
63,YouTube,2025-06-09,http://martin-smith.net/,Movement near human election writer.,69843,13514,2047
220,YouTube,2025-07-04,http://valenzuela.com/,Real condition thank along product government blue.,41915,7155,1567
112,YouTube,2025-07-08,http://anderson.org/,Other analysis piece.,42481,4019,548
294,Instagram,2025-05-10,https://cummings.com/,This change always drive.,131922,7781,3638
71,Twitter,2025-04-25,http://hernandez.com/,Building onto administration degree.,5211,639,94
126,Instagram,2025-06-02,http://long.com/,Fund color election space fall case glass.,5313,749,119
121,YouTube,2025-06-08,http://www.robles-lawrence.com/,And small pass in.,42895,6766,1688
135,Twitter,2025-06-25,http://summers-boyd.info/,Possible themselves catch know as.,124141,22235,6084
122,YouTube,2025-07-14,http://www.graham-jones.com/,Campaign threat among loss could become can difficult.,25257,1758,626
296,Instagram,2025-04-29,http://byrd.org/,Next bad claim.,6002,805,136
57,YouTube,2025-07-03,http://browning.com/,Woman partner sort court Democrat well democratic.,125209,15021,2591
38,YouTube,2025-07-06,http://meyer-brown.org/,Challenge hold civil after almost.,142554,12428,1977
164,Instagram,2025-06-08,https://spears.biz/,Support team ago require finish despite color.,113609,10626,2881
23,Twitter,2025-07-11,http://bailey.info/,Yeah arm eye red bring measure rich plan.,9886,1406,197
130,YouTube,2025-05-23,http://andrade-johnston.com/,Determine hear four yes.,143158,25739,2346
278,Twitter,2025-05-14,https://www.archer.info/,Glass order they weight.,54182,5370,1793
67,Instagram,2025-06-14,https://newman-huynh.com/,Growth especially a current church culture visit.,16025,1552,649
69,Instagram,2025-05-08,http://www.smith.biz/,Policy indicate fight lose.,26157,3262,800
123,Twitter,2025-06-07,https://adams-webster.net/,Career spring gas forget space reach grow.,90162,11253,2014
234,YouTube,2025-06-21,https://www.crosby.com/,Gas apply ever reduce phone speech.,90716,4851,4337
85,Instagram,2025-04-26,https://www.henderson.com/,Forward example ahead huge.,61939,7792,3014
163,YouTube,2025-06-11,http://brown-warren.com/,City pattern change picture office.,163411,13444,3940
281,YouTube,2025-04-24,http://yu.com/,Security eye step himself.,82377,4743,2454
236,Instagram,2025-05-12,http://www.montgomery.net/,Billion may full ready home own newspaper.,99980,18231,3616
29,Twitter,2025-07-09,https://www.wallace-kirby.com/,Blue form blue sea.,74338,8964,2339
276,YouTube,2025-06-16,http://schaefer.com/,Safe position state speak.,108917,19286,2966
156,YouTube,2025-06-08,https://www.hardy.com/,Show research cover billion least really hair.,31373,5721,1226
123,Twitter,2025-06-27,https://castillo-ray.org/,Cause former wife world central start common.,43396,7142,1069
212,Twitter,2025-06-27,http://www.brown-lambert.com/,Kid may seven about stage.,101451,11168,3328
225,YouTube,2025-06-14,https://hodges.com/,Involve way arm crime machine everybody.,64407,5100,2069
22,Instagram,2025-07-04,https://www.butler-smith.com/,Including popular fly short.,33164,2023,1000
114,YouTube,2025-06-17,http://munoz.com/,Treat be themselves pass time.,159293,26229,3375
42,Twitter,2025-05-27,https://www.pittman.com/,Strategy radio culture everybody authority.,26223,5201,975
220,YouTube,2025-05-30,https://www.skinner.com/,Meet local ever pull.,123847,8399,6068
96,YouTube,2025-06-04,http://farley.org/,Forget could never prove.,2332,254,97
273,YouTube,2025-06-06,http://harrison.com/,Apply officer for practice.,93278,9408,4436
76,Twitter,2025-05-21,http://www.hawkins.com/,Probably price leg once assume.,10216,1667,183
267,Instagram,2025-05-13,https://vargas-garcia.info/,Husband answer call speech watch speak form.,192509,24327,5775
122,YouTube,2025-05-22,http://www.oneal.com/,Unit career remember those happy manager provide move.,44197,2510,684
289,Instagram,2025-04-26,http://www.schroeder.biz/,All fine reality and.,99385,9934,2877
298,YouTube,2025-07-07,https://meyer.com/,Must open beat those throw camera.,135793,16098,4650
53,YouTube,2025-07-16,http://www.johnson.com/,Miss place hope degree painting record.,13296,1692,307
19,YouTube,2025-06-19,http://rogers.com/,Authority college stage national program east.,3297,468,54
145,Twitter,2025-06-01,https://www.reeves.com/,Technology environmental maybe under artist skill issue.,67292,13363,2662
266,YouTube,2025-04-27,https://www.mcgee.net/,Course continue act become short debate kind.,71663,6799,1680
67,Instagram,2025-05-18,http://bridges.com/,Assume appear word section area myself still.,9246,1611,289
23,Twitter,2025-06-12,http://johnson.biz/,Wonder before seek site some.,5128,801,112
271,Instagram,2025-07-05,http://www.adams.com/,Data country third already.,38742,6677,958
255,Twitter,2025-06-17,https://www.brennan-neal.org/,Find boy bed imagine risk give group.,69941,10566,3440
145,Twitter,2025-07-10,https://www.smith-higgins.org/,Word surface rich.,110863,15249,4641
21,Instagram,2025-05-27,http://perez-salazar.org/,I camera center test of beyond let resource.,199010,31602,7467
204,YouTube,2025-06-18,https://www.vargas-sanders.net/,Small lay but white.,182039,9829,5276
163,YouTube,2025-07-07,https://www.garcia.com/,Effort coach radio coach.,136397,26605,5635
294,Instagram,2025-05-23,https://adams-phillips.biz/,Success art anything trial middle.,132547,22059,4388
5,Twitter,2025-06-10,http://martinez-waters.com/,Cause cultural right adult paper toward since.,79536,12583,2651
77,YouTube,2025-07-07,https://www.adams.com/,Growth just group account character of travel.,21804,1647,766
96,YouTube,2025-06-01,https://www.smith-davis.com/,By month young both.,4499,643,196
37,YouTube,2025-04-30,https://arnold.org/,Sure make civil strategy task situation glass.,74527,5378,2774
49,Twitter,2025-07-01,https://www.vincent-gross.org/,Soldier evening culture.,6009,328,288
188,YouTube,2025-05-10,http://www.cantrell-johnson.com/,Good just our wife follow stand management describe.,11071,736,119
100,YouTube,2025-06-08,http://www.king-smith.info/,Lot action doctor trial easy serious tax.,120308,11676,1931
68,Instagram,2025-06-04,http://www.maldonado-hill.com/,Available discover set investment position statement sign.,32135,4935,848
216,YouTube,2025-06-21,https://boyer-cherry.com/,Small most professor with example back rather.,8241,1370,385
82,YouTube,2025-05-11,https://www.thompson.biz/,Official physical recent part impact stock not throw.,16172,2925,637
163,YouTube,2025-06-25,https://www.chavez.com/,Full blood picture forward.,68807,4083,1068
185,Instagram,2025-05-15,http://www.wagner-thompson.com/,Couple nearly child perform.,60883,4937,1400
86,Twitter,2025-05-09,http://www.meyer.com/,Claim issue force lead through.,6074,907,188
213,Twitter,2025-06-28,http://www.fox.com/,Item wide beautiful out discussion plan very.,144825,14057,2451
226,Instagram,2025-07-07,https://www.clark.com/,Certainly place three piece economic.,98406,18384,2331
111,YouTube,2025-05-25,http://www.lopez.biz/,Begin well through gun ago.,24752,2552,1011
274,YouTube,2025-04-30,https://miller.com/,Born effort game.,101488,16049,3626
89,Twitter,2025-06-12,https://adams.com/,Budget for board together strategy remain ask.,47610,7331,1637
210,Instagram,2025-06-16,http://www.doyle-keller.com/,She election police worker behind especially.,9544,752,189
183,YouTube,2025-07-04,http://www.poole-parker.org/,Herself phone task seat put.,46119,6166,876
268,Instagram,2025-07-05,https://harrington.com/,Pay year rather few.,15699,3076,343
34,Twitter,2025-05-07,http://www.edwards-kemp.com/,Become seat ask while computer.,8508,794,155
110,Twitter,2025-05-28,https://www.nolan.org/,Operation although especially control effect benefit.,69487,10822,1576
173,Twitter,2025-07-20,http://www.olson.com/,Quality I feeling.,73648,7535,3487
18,Twitter,2025-06-17,https://curtis.net/,Challenge artist knowledge thus enter board.,46679,7903,977
31,Twitter,2025-06-11,https://www.camacho-hodge.net/,Challenge southern media north.,128066,8744,4746
107,Twitter,2025-05-30,https://hill.org/,Price often general feel never.,99136,10603,4878
251,Twitter,2025-04-30,http://davis-bean.net/,Time explain lay thought positive.,12932,2234,623
158,Instagram,2025-07-06,https://www.brown.biz/,Several across certain dream exist pressure sport.,143600,24511,3104
59,Instagram,2025-04-23,https://www.cox.info/,Wrong term edge rather.,84486,7869,3258
193,Twitter,2025-05-07,https://www.beck.com/,It product write dark cold never quite.,59251,6040,1640
49,Twitter,2025-06-08,https://knight.com/,Control understand development actually.,5484,485,159
25,Twitter,2025-06-29,http://moore-houston.com/,Continue always difficult three often long general.,87745,7046,2767
138,YouTube,2025-06-06,https://www.jordan-singleton.com/,Five a then add including blue some.,61762,11731,2337
153,Instagram,2025-06-08,http://roberts-friedman.com/,Nothing writer administration great test offer see.,110883,7827,3839
97,Instagram,2025-05-07,https://austin.com/,Shoulder successful our recently.,57788,7976,1138
26,Twitter,2025-05-14,https://www.sims.net/,Though learn even magazine new election.,54701,8231,1708
252,Instagram,2025-07-17,http://www.tran.com/,Man particular even.,152782,22259,1848
209,Twitter,2025-05-16,https://www.smith.org/,Best be such bill speak ahead thought.,107965,12091,4177
35,Twitter,2025-04-23,http://garrison.com/,People night forget visit woman worry.,119752,7793,4889
93,Twitter,2025-04-24,http://murphy.com/,Necessary trouble control budget glass establish upon.,43727,2220,1399
192,Instagram,2025-04-25,https://moore-simmons.biz/,Bill record store carry fight standard when.,18861,3571,495
295,YouTube,2025-06-02,http://rhodes-maldonado.org/,Once but experience certainly product born hospital.,59225,11267,2673
141,Instagram,2025-07-18,http://murphy.biz/,Your ahead during challenge piece finally.,19741,2400,354
53,YouTube,2025-05-05,http://carter-mcgee.com/,Adult support total sure near but say.,8362,1627,191
169,YouTube,2025-07-04,http://www.carson-kelley.com/,Night group set character after.,169448,24889,7848
114,YouTube,2025-06-09,http://cooper.biz/,Shoulder exactly boy yeah.,193127,12247,6366
232,Instagram,2025-07-14,http://www.dyer.com/,Yard successful area third raise nice huge.,163955,21358,6381
11,Twitter,2025-06-06,http://www.collins.net/,Fight direction Republican total into evening oil technology.,80985,15427,3768
258,Twitter,2025-07-21,https://evans.com/,For enter first organization.,13744,1048,622
32,Twitter,2025-06-25,http://www.erickson-saunders.com/,Upon performance discuss body film.,46654,3562,2182
231,YouTube,2025-07-14,https://www.torres.biz/,Movie news or.,118092,23568,3056
38,YouTube,2025-05-19,https://www.le-johnson.com/,Cultural rule ground win model unit create room.,139891,17389,6639
30,YouTube,2025-07-21,https://www.thomas-taylor.com/,Poor draw week choose.,61936,12035,2913
48,Instagram,2025-05-01,http://www.gardner-crane.info/,Save teacher friend us dog recognize where.,77258,14023,801
269,Twitter,2025-05-06,http://www.diaz-blake.com/,Mention peace share.,90660,12256,1295
223,YouTube,2025-06-11,https://www.dixon-woods.biz/,President politics know increase.,54643,10789,1168
94,Instagram,2025-05-11,http://jacobs.com/,Guy rise yard maintain probably.,42819,8493,1358
158,Instagram,2025-06-09,http://clark.org/,During entire page later by Democrat.,160281,19888,7620
28,Instagram,2025-07-02,http://espinoza-austin.net/,Newspaper agreement huge investment must half activity.,94735,16830,2720
13,Twitter,2025-04-28,https://www.harris.com/,Off couple offer mean new across.,177885,14038,2580
34,Twitter,2025-06-27,https://www.taylor-rodriguez.com/,Ready page attack world seat sign.,2759,205,78
167,Instagram,2025-07-14,https://west.biz/,Agreement many better.,24233,2146,422
298,YouTube,2025-07-17,http://www.jordan.com/,Film candidate answer like me body seat.,132571,21276,5519
190,YouTube,2025-06-13,http://mahoney.com/,North need man so job reason whatever.,105036,14197,4232
227,Instagram,2025-05-02,https://morgan.biz/,Fall agent moment instead yourself watch senior.,57409,4381,2540
299,YouTube,2025-06-06,http://woodard.com/,Star future property nearly student which generation.,85532,15785,3684
159,Twitter,2025-05-08,https://www.ferrell.net/,Authority good city outside say follow population.,23248,2959,313
135,Twitter,2025-05-17,https://www.kirk.info/,Enjoy generation happen little ahead customer after.,36991,5563,643
235,YouTube,2025-05-15,https://kirby.com/,Third see bit information.,25563,1817,586
161,Instagram,2025-05-11,https://brown.com/,Available keep identify notice serve almost staff huge.,30869,2691,630
288,YouTube,2025-05-29,https://www.nixon-mitchell.com/,Window near away property.,16664,1421,669
105,YouTube,2025-05-02,https://www.bishop.com/,Evidence poor development writer.,15943,3078,351
2,Instagram,2025-05-01,https://lopez.biz/,Well cover half ago Mrs.,108131,17131,1130
65,Instagram,2025-07-06,http://www.jenkins-fields.info/,Book throughout model training whether professor protect.,36097,5344,1361
260,Instagram,2025-05-22,http://santiago.net/,Ball music build daughter usually.,84032,4984,1237
79,Twitter,2025-06-21,https://williams.net/,Onto determine soon your prove station history.,6561,629,172
185,Instagram,2025-04-30,http://www.nguyen.com/,Try detail hour he.,51927,6510,2378
266,YouTube,2025-06-12,https://www.powell.info/,Feel perform nor record else late certain simply.,65850,10241,1477
96,YouTube,2025-07-17,http://www.clark.com/,Per quality our unit compare natural.,2898,195,135
145,Twitter,2025-05-25,http://www.wallace.com/,Admit particularly hear even always.,98417,9276,3403
168,Instagram,2025-06-05,https://vega-khan.com/,Civil cell remain strategy young free.,92676,7679,1421
157,Twitter,2025-05-02,http://www.jones-carroll.com/,Thought father measure bag then.,71964,5251,2872
45,Instagram,2025-06-18,https://www.young.com/,Congress approach itself Mrs.,40164,5657,1069
91,Instagram,2025-07-13,https://deleon.com/,Follow PM speech family.,41558,5501,1198
70,YouTube,2025-07-06,http://www.morrow.com/,Police believe above only discussion.,183681,23993,6716
48,Instagram,2025-06-03,https://harris.net/,Author cut style night history.,56560,4681,1125
109,Twitter,2025-06-21,http://www.crawford-barber.com/,Doctor pressure crime.,16240,2650,729
277,Twitter,2025-05-18,http://nicholson.com/,Direction task seven.,76426,4759,2129
27,Instagram,2025-06-13,https://lopez.com/,Arrive create race beat see yeah word house.,68567,10666,899
122,YouTube,2025-06-16,https://combs-thompson.net/,Hair price try whether.,31486,4238,392
145,Twitter,2025-07-02,https://hendrix.com/,Put man area present want rich.,41674,5507,1259
2,Instagram,2025-05-12,http://www.middleton-schmidt.org/,Action around certainly choice any a.,129489,17598,2071
279,Instagram,2025-05-01,https://www.johnson.info/,Summer view wish majority and network.,93054,9232,2867
163,YouTube,2025-07-18,http://www.richardson-smith.org/,Accept study something.,76881,5184,1400
42,Twitter,2025-07-18,https://www.turner-hunter.biz/,Might race tend well computer.,61664,8477,840
223,YouTube,2025-07-11,http://www.boyd-price.com/,Note painting style heart culture.,24321,3077,1029
228,Twitter,2025-06-05,http://ellis.biz/,Note poor lay similar.,155185,18314,4737
206,Instagram,2025-05-17,https://sims-young.com/,Arrive sometimes southern read front position share.,36786,4359,452
5,Twitter,2025-04-24,https://cox-walker.com/,Standard again person tree.,130180,15537,5503
199,Twitter,2025-07-02,http://gonzalez.com/,Design alone up newspaper pattern.,65731,10417,1698
181,Instagram,2025-05-13,https://brown.com/,Plant get wall myself.,188793,32560,7520
229,YouTube,2025-05-31,http://williams.com/,Data enjoy south which side.,12067,1650,142
165,YouTube,2025-06-04,https://www.cisneros.org/,Improve no myself happy board something nation.,3552,361,44
124,Instagram,2025-07-09,http://benton.com/,Beyond air book history executive.,38639,7693,1830
251,Twitter,2025-05-28,https://barrera.org/,Pull nor good now practice mission phone.,28201,1702,1335
218,YouTube,2025-05-06,http://morgan.info/,Ever investment today report mission however data.,73565,4028,1938
47,Instagram,2025-07-17,https://scott.com/,Television few statement floor first bad land nothing.,15195,2512,617
186,Twitter,2025-05-15,http://www.erickson-ross.com/,Who in toward figure executive his traditional fast.,140117,27568,5021
32,Twitter,2025-06-21,http://www.hanna-reilly.com/,Raise somebody dream so once growth draw.,90897,10276,4518
182,Instagram,2025-06-24,https://www.stout-gordon.com/,Guy above popular free.,152655,16390,6836
128,Instagram,2025-06-13,https://richardson-floyd.org/,Ready test organization leader gas.,63502,11812,1589
44,Twitter,2025-06-11,http://beasley.info/,Success teacher worker least.,75387,11489,2749
87,Twitter,2025-06-27,http://morgan-butler.com/,Certain health work clearly six present.,105977,13871,3830
232,Instagram,2025-07-05,http://perez.biz/,Various far very half management.,179041,18291,3068
162,YouTube,2025-06-03,http://curtis-anderson.com/,Matter human during nearly religious carry prepare.,182406,23820,5682
18,Twitter,2025-06-30,https://www.anderson.com/,Team teach yourself deal.,28485,4534,538
204,YouTube,2025-04-28,https://brown.info/,Sound stop could reduce hear save good.,160026,8084,1745
289,Instagram,2025-06-27,https://www.sims.org/,Plant authority group fire analysis civil sound authority.,92411,8756,3413
62,Instagram,2025-06-20,http://curry.com/,On ever suggest instead professional manage.,10292,1355,321
284,Instagram,2025-05-06,http://oneill-wilson.com/,Trial type despite hair.,65428,11352,1302
13,Twitter,2025-05-15,http://klein-king.com/,Truth thousand claim commercial public population really.,73555,7497,1546
109,Twitter,2025-07-10,http://gray.com/,Wonder guess mind technology if read modern.,23493,4478,916
108,YouTube,2025-06-05,https://www.ellis.org/,Address out seek claim.,10784,721,457
298,YouTube,2025-06-28,http://adams-wilson.com/,Worker eight book beyond outside war forward.,147482,16648,5993
241,Twitter,2025-07-17,http://www.chapman.com/,Red animal yes enjoy light.,61453,11219,652
174,Instagram,2025-05-19,https://ball.net/,Often with goal describe.,76779,6212,1077
267,Instagram,2025-06-25,https://www.chapman.com/,Attack tell artist friend leg.,200953,11059,6814
52,Instagram,2025-05-16,https://rollins-black.com/,Hear offer follow hope oil.,137137,21323,1638
126,Instagram,2025-05-19,https://cobb.net/,Own back hear goal include.,11022,1775,287
267,Instagram,2025-07-10,https://fletcher-williams.net/,Understand power physical college.,78827,6712,1473
159,Twitter,2025-06-19,https://www.hall.net/,Then wonder else agree help series night game.,17244,3096,211
197,Instagram,2025-05-20,http://www.mckinney-andrade.com/,Just tonight serious page bring language send.,38359,4817,827
192,Instagram,2025-07-20,https://www.mitchell.com/,Medical compare public professional worry involve.,19704,3396,773
96,YouTube,2025-07-07,http://www.frank-banks.com/,Behind moment computer sell outside store.,4924,481,167
66,Twitter,2025-07-21,https://lawson-johnson.net/,Option to garden deep.,25447,3839,580
98,YouTube,2025-06-27,https://www.wilson.net/,Page collection glass again federal service.,143580,13678,2258
3,Instagram,2025-07-17,http://www.holt.biz/,Laugh network whether draw table.,115985,17285,2185
125,Twitter,2025-07-18,https://www.martinez.org/,Bring full direction man various oil.,198146,18838,2464
197,Instagram,2025-06-07,http://ortiz.com/,Us gun fine school carry.,54473,10473,2461
29,Twitter,2025-06-25,http://www.anderson-harris.info/,Follow growth from charge about.,70757,13212,2479
298,YouTube,2025-06-18,https://www.ellis.com/,Test poor focus few enjoy debate.,149177,17018,4449
189,YouTube,2025-07-20,http://livingston.com/,Street career which appear certainly.,45031,8819,2146
276,YouTube,2025-07-03,http://www.griffin.net/,Expert perform without.,145685,21954,6036
80,Twitter,2025-06-23,https://simpson.com/,Think event evidence.,47142,4610,1256
28,Instagram,2025-05-01,http://gilbert.com/,Identify west prepare senior.,98649,7140,2471
152,Instagram,2025-07-07,https://www.morgan-fernandez.com/,Foreign trip every poor two space thing movement.,168772,27537,4884
35,Twitter,2025-04-26,https://www.lyons-collins.com/,Its during military between stock describe.,125795,22316,2771
187,Twitter,2025-07-14,https://guzman-gilmore.com/,Available move there effort throw.,129413,20206,5465
172,Twitter,2025-04-28,https://reid.biz/,However special speech economy.,14720,2755,478
94,Instagram,2025-06-27,https://www.li-burgess.com/,Letter short address Mr.,26912,5252,869
58,Instagram,2025-06-24,https://www.walker.biz/,Same start girl role tough out.,100932,7076,1989
86,Twitter,2025-06-13,https://www.baker.com/,Within heavy different operation.,13466,1084,483
103,Twitter,2025-05-06,https://www.thompson.com/,Small soon manager politics garden professor.,36405,6856,1597
211,Twitter,2025-05-10,https://www.scott-miller.com/,Media television religious serve woman cell couple.,87110,5563,3395
244,Twitter,2025-06-02,https://saunders.biz/,Live candidate no.,18741,1472,388
300,Twitter,2025-05-23,https://cortez-hubbard.com/,Before entire staff end a seat.,37572,5675,1281
42,Twitter,2025-04-30,http://kennedy.com/,Guy have allow response.,29250,5295,512
289,Instagram,2025-06-24,https://fox.com/,Reason upon question once medical.,203822,33478,7943
78,YouTube,2025-06-25,https://davidson-lindsey.com/,Manager read figure network.,48908,6545,1426
155,YouTube,2025-07-11,https://sandoval.org/,Difficult identify knowledge fire hotel they.,81816,14761,1907
238,Twitter,2025-05-21,http://butler.biz/,Lot somebody city every position.,20668,4000,219
270,YouTube,2025-06-15,https://www.howard.com/,Step the employee anyone arm wish less realize.,29224,5569,1416
252,Instagram,2025-06-15,http://www.lee.com/,Community various night huge.,119745,8094,5985
255,Twitter,2025-06-17,http://brown-carpenter.com/,Group several bad bill mouth size information.,81198,9893,1599
125,Twitter,2025-06-03,http://www.reese.com/,House who establish discuss contain.,112765,15861,2050
154,Twitter,2025-05-12,http://smith-carter.biz/,Group radio leg clear.,47639,8921,1528
274,YouTube,2025-05-10,http://www.bradford-page.com/,Possible professor there cost statement behavior deal.,63064,10489,1590
69,Instagram,2025-05-09,https://www.ortiz.com/,Tend lawyer process nothing red out.,63226,8222,1540
131,Instagram,2025-06-20,http://www.lawson-humphrey.com/,Nation computer lot left family room program.,88351,7883,2695
57,YouTube,2025-06-01,http://austin-hernandez.com/,Tonight simply list.,130807,16297,1824
193,Twitter,2025-04-26,https://www.gibson-gray.com/,Fight class by front unit be.,102296,20172,2944
66,Twitter,2025-06-28,https://www.jones.com/,Statement ok wind significant.,32437,5707,1510
175,YouTube,2025-06-11,https://powell.com/,Shake partner policy lawyer discuss goal affect.,96562,10197,2564
242,Instagram,2025-06-14,https://www.beasley.com/,Week character soldier stay thousand little national side.,87876,11808,1656
9,Instagram,2025-06-21,http://garrett.com/,System read whole scene.,79327,5702,1620
242,Instagram,2025-06-18,http://randolph.info/,Project look can democratic cup.,81490,15500,2702
146,Instagram,2025-06-30,http://www.carter-hansen.info/,Pm chance hard happen price.,71711,8077,1154
93,Twitter,2025-05-06,https://www.anderson-miller.com/,Really ball for certainly allow.,119799,11917,3018
