influencer_id,platform,date,url,caption,reach,likes,comments
42,Twitter,2025-05-11,http://www.reed-hayes.biz/,Other research rise.,48515,3443,1022
238,Twitter,2025-04-27,http://romero.com/,Road feel nature before no history.,15041,942,483
99,Instagram,2025-05-28,https://pacheco-humphrey.net/,Head late weight world detail budget.,110723,15501,3798
205,Instagram,2025-04-26,http://zhang.biz/,Any yard world some continue.,39337,6563,1479
207,YouTube,2025-05-08,https://www.hunter.com/,Eight others any hotel idea.,65409,11589,2376
149,YouTube,2025-06-09,https://www.hill.com/,Too prepare someone.,68050,6481,2089
191,Instagram,2025-05-04,http://www.harris.com/,Public face person attorney pattern.,8025,1014,320
155,YouTube,2025-06-24,https://www.jackson.com/,Action address scene.,63325,5973,771
241,Twitter,2025-06-25,http://www.lee.net/,Down one right light yes miss read various.,121054,22357,5833
175,YouTube,2025-05-12,http://marsh.org/,Rest organization apply today.,163286,20285,2369
109,Twitter,2025-06-21,https://nunez.net/,Local concern TV two stage must tough.,15414,1925,520
287,YouTube,2025-04-28,https://perez.com/,Lawyer teacher nearly no stage painting.,182828,23629,8978
155,YouTube,2025-05-17,https://shaw.biz/,Ready reduce memory behind.,40201,7961,1903
285,YouTube,2025-06-11,http://randolph-martin.net/,Foreign treat audience reflect view trouble pretty account.,13561,946,602
191,Instagram,2025-07-14,http://www.clark-king.com/,Peace from page few who picture.,7782,1052,191
180,YouTube,2025-07-16,https://paul.net/,Difference design onto plan first past.,78884,12025,3195
121,YouTube,2025-06-16,http://www.dawson.biz/,Forward tree teacher resource.,130480,25204,5325
209,Twitter,2025-06-14,http://www.ramsey.net/,Until college structure scene rest.,101038,5304,1283
101,YouTube,2025-06-06,http://kim.com/,Network learn bag force but spring eye cell.,142841,12759,1655
250,YouTube,2025-06-09,http://www.ortiz.org/,Either least network college.,139652,8249,5805
293,Instagram,2025-07-06,https://mendoza-padilla.biz/,Skill difficult treatment resource improve music.,114135,14380,4011
17,YouTube,2025-06-16,http://roberts-mckee.net/,Determine talk despite both.,74414,9313,1980
5,Twitter,2025-07-07,https://costa.com/,Current be sing skin whether statement.,75953,11793,1009
113,YouTube,2025-06-16,https://www.young.com/,Mother art their reality manage rest fire wind.,83604,10909,2896
286,Twitter,2025-04-28,http://rivera-scott.com/,Whatever building seat dream.,49318,4518,1104
206,Instagram,2025-07-12,http://wright.org/,Citizen compare around cultural key owner point.,70326,8910,1274
132,Twitter,2025-05-30,http://www.huffman.com/,Point behind the name himself once dog.,135429,23186,4260
199,Twitter,2025-05-31,https://www.nichols.com/,Provide describe western yet have force Mrs.,53129,5770,1879
251,Twitter,2025-06-10,http://johnson.com/,Nature partner brother event.,40805,7148,1519
245,Twitter,2025-07-02,https://edwards-ramos.com/,Tough mouth eye play.,89322,5351,3389
42,Twitter,2025-06-15,http://yu.org/,Health west check low wear.,78145,12463,3427
287,YouTube,2025-05-02,https://terry.info/,Against accept respond both law off model property.,179713,10546,2416
243,Twitter,2025-06-28,https://www.gates.com/,Fall speak what gas know yard others.,47607,5483,1339
66,Twitter,2025-07-14,https://www.reese.com/,Surface back rest color drive.,30806,4353,689
147,YouTube,2025-05-06,http://bradley.com/,Use fact speak just.,38910,6274,1541
178,Twitter,2025-06-25,https://www.sims.com/,Head low lawyer available walk.,26260,1783,1006
205,Instagram,2025-07-07,https://hernandez.org/,Must rule expect training foot star.,26676,4140,441
240,YouTube,2025-05-03,https://www.wall.net/,Ago mention this.,90006,17366,2783
198,Instagram,2025-05-21,http://jones.com/,Exist anyone plant somebody.,71857,12032,2790
112,YouTube,2025-05-25,https://www.montoya-warner.net/,Once out rise.,76442,5736,1152
199,Twitter,2025-07-02,http://www.cline-richardson.org/,Their them analysis focus before decide growth.,128532,21486,2667
10,YouTube,2025-05-10,https://www.murray.com/,Room music return interesting step.,70604,12917,2884
245,Twitter,2025-05-04,http://wilson.biz/,Arrive generation yes maintain.,81575,4437,3449
167,Instagram,2025-06-28,http://www.wilson.com/,Water several run century firm.,28732,2608,360
133,Instagram,2025-06-25,http://www.dougherty-garcia.com/,Star particularly wonder.,33088,5189,1094
73,YouTube,2025-07-04,http://thomas.info/,If new when western two high.,43006,2647,1213
58,Instagram,2025-07-18,http://www.anderson-mcgee.com/,Loss however many believe expert eight treatment.,51937,5402,1557
240,YouTube,2025-06-26,http://martin-marquez.com/,Central myself event cut.,60846,8216,1503
300,Twitter,2025-06-08,http://www.gonzalez.com/,Plant away compare air technology.,36537,3225,515
31,Twitter,2025-06-28,https://chavez.com/,Similar involve decision mouth establish.,77860,10595,3029
241,Twitter,2025-06-09,http://cook.com/,Mr federal discover this agent Democrat.,179478,15122,5447
113,YouTube,2025-06-26,https://walsh.info/,Like miss weight culture sure friend apply.,62692,3548,2790
216,YouTube,2025-06-26,http://www.nelson.com/,Movement table case method leader six sound least.,6103,529,176
260,Instagram,2025-05-03,http://www.olson.com/,Appear himself so in election contain.,113441,12188,1815
60,Instagram,2025-06-02,https://meyers.biz/,Article improve recent.,130264,24707,5770
70,YouTube,2025-06-17,http://www.hinton-reed.com/,Technology hotel carry into.,135881,18062,6326
96,YouTube,2025-05-07,http://novak.org/,Outside carry site require design between blood.,7359,1185,197
271,Instagram,2025-04-28,https://www.davidson.biz/,Decade wide both.,60568,5952,1614
272,Instagram,2025-05-13,https://diaz.com/,College tree forget call may set.,35954,5682,749
11,Twitter,2025-06-25,http://ford.com/,Adult paper television down you onto.,117833,7268,2935
283,YouTube,2025-06-02,https://rogers.biz/,Traditional speak occur oil.,207107,25951,9543
262,YouTube,2025-05-04,http://romero.com/,Daughter person thing keep.,33213,2554,1400
154,Twitter,2025-07-17,http://flowers.com/,Decide address maintain stuff.,66376,13090,3196
21,Instagram,2025-05-09,http://wood.com/,Finish position type mother describe.,194197,11717,5554
106,Twitter,2025-07-08,http://robinson.org/,Them listen add any.,62765,5796,2748
104,Twitter,2025-05-22,https://cobb-kelley.net/,Answer cover plant too give get yard policy.,68784,6816,2209
181,Instagram,2025-04-30,https://www.harding-wilson.com/,Chance as receive box.,96198,4924,1734
255,Twitter,2025-05-26,http://warner-baird.com/,Ago offer there law exist.,73829,9935,1635
287,YouTube,2025-07-20,https://rose.com/,Tv out quality woman.,189604,27190,5414
139,Twitter,2025-06-26,http://compton.org/,Defense technology already right list pattern many.,109865,15244,3266
72,YouTube,2025-05-29,http://www.callahan.info/,Young even maybe beautiful significant itself.,69145,11470,1231
247,YouTube,2025-06-22,http://www.williams.com/,Also easy spend through near kind material.,128347,23752,5187
131,Instagram,2025-06-03,https://foster.info/,Argue benefit share perhaps which.,151868,13177,1557
92,Twitter,2025-04-28,https://www.mccarthy.com/,Face professor music herself.,191533,21356,3700
6,YouTube,2025-04-27,https://www.turner.com/,Off fish no else for.,62643,6387,2730
142,Twitter,2025-06-05,http://www.turner.biz/,Morning his employee property deal.,177413,32214,8522
214,YouTube,2025-06-02,https://norman-gordon.com/,Provide pick others sign discussion want six.,47958,2408,1740
44,Twitter,2025-05-26,http://www.fletcher.com/,Consider employee green.,65768,11664,2570
70,YouTube,2025-05-20,http://www.martin.biz/,Back between meet school.,60562,3972,1889
85,Instagram,2025-05-30,https://lam.biz/,Box that finally notice someone.,46368,3974,1376
217,Twitter,2025-07-11,http://www.green-mccullough.com/,Policy past catch prove peace but scientist.,53504,3155,2668
77,YouTube,2025-07-17,https://nash.org/,Dog drop service.,15272,2393,209
174,Instagram,2025-05-07,https://meyer.com/,Direction lay political pressure local represent phone here.,143981,27095,6607
124,Instagram,2025-06-02,https://landry.com/,Continue travel employee.,71845,9193,2732
163,YouTube,2025-06-13,http://anderson.com/,Similar although vote international establish civil team.,177118,18752,8675
105,YouTube,2025-05-09,https://lopez-jackson.com/,Girl major maybe firm couple garden once.,10989,689,151
59,Instagram,2025-06-09,https://dean.com/,Past without increase way state such.,65567,4591,2806
200,Instagram,2025-07-16,https://bush.com/,Low hope action.,171309,10488,5604
261,Twitter,2025-05-28,https://barrett.com/,Affect center evidence among I decision.,4249,489,206
192,Instagram,2025-06-21,https://jensen-lopez.com/,Pretty official see gas whom.,17696,1513,361
10,YouTube,2025-07-21,https://bray-kaufman.org/,Born small young local decision husband.,60280,5862,2533
285,YouTube,2025-07-07,http://www.king.org/,Because respond wait economy democratic dinner.,10758,1668,424
263,YouTube,2025-06-08,http://gates.org/,Interest impact bed top person go.,80415,7857,1678
58,Instagram,2025-07-09,https://roberts.org/,Environmental attack trade discover pay provide.,131187,8029,2375
146,Instagram,2025-06-13,http://wells-perkins.biz/,Interesting pressure while beat.,80219,13395,2678
219,YouTube,2025-06-04,http://mclaughlin.com/,Partner left wife individual scientist generation red during.,18659,1367,309
191,Instagram,2025-06-29,http://www.curtis.com/,Five something improve fight senior.,6974,836,183
148,YouTube,2025-05-22,https://www.porter.biz/,Maintain bill letter call.,83856,10933,4074
291,Twitter,2025-06-23,https://www.moreno-benson.net/,Player kitchen though finish throw here economic.,5409,438,120
27,Instagram,2025-06-17,https://christensen.info/,Sure live official night single anything.,101436,9104,1500
40,Instagram,2025-06-26,http://www.sawyer.com/,Seven condition use site.,102545,7551,3839
198,Instagram,2025-06-24,https://davis.com/,Society include onto girl kind despite.,39934,6946,1512
292,Instagram,2025-06-22,http://cooke.com/,Dark age alone.,6629,371,287
226,Instagram,2025-05-27,http://www.nichols.com/,Crime agency forget.,121565,12055,1659
281,YouTube,2025-07-15,http://ramirez.biz/,Response available thousand.,60591,5285,1468
297,Twitter,2025-05-05,https://www.love.biz/,Stage west question them child civil.,139241,17686,5164
165,YouTube,2025-07-05,http://www.rivas.com/,Policy nation any range player hand wait sit.,4895,435,242
41,Twitter,2025-05-30,http://malone.net/,South whole order brother have.,54293,2967,1421
59,Instagram,2025-06-25,https://www.williamson.info/,Likely center method speak road participant difference.,109253,12873,4361
273,YouTube,2025-07-12,http://grant.info/,Like politics marriage town vote write physical.,70927,6204,2020
219,YouTube,2025-06-12,https://higgins-smith.com/,It put end story.,42263,7209,658
40,Instagram,2025-06-14,https://www.vasquez.com/,Agreement impact fire ten next place in.,129554,6710,5598
275,Twitter,2025-05-16,https://www.hamilton.com/,Film those sure onto must something.,93815,18517,1428
273,YouTube,2025-07-10,https://www.williams.com/,Peace hair fine me.,110055,19100,2739
133,Instagram,2025-05-13,http://www.davis.com/,With statement week school generation will question.,83178,12022,2976
220,YouTube,2025-07-01,http://www.vargas.com/,Mouth inside site rather candidate region.,132140,18149,2689
24,Instagram,2025-07-16,https://davis.com/,East pay we approach.,33181,5704,360
283,YouTube,2025-06-23,https://thornton.com/,Affect performance responsibility.,209878,12523,9675
132,Twitter,2025-07-05,http://castro.com/,I positive former ready land building traditional ball.,112289,13083,1701
167,Instagram,2025-05-08,http://www.williams.biz/,Become either artist fight.,20805,3864,898
239,Instagram,2025-04-27,https://www.day.biz/,Quality line customer modern likely strategy training.,176402,17593,2065
53,YouTube,2025-06-29,https://torres-randolph.com/,Market it represent long look a.,7681,915,128
116,Twitter,2025-07-12,http://pope-reed.com/,Do those front play them hand put.,8705,1184,373
17,YouTube,2025-07-20,https://stevens-garza.info/,Member force work bill charge.,37902,4140,423
119,Instagram,2025-05-07,http://www.blankenship.info/,Model perform draw she dog.,27934,4259,472
155,YouTube,2025-07-18,http://webb-brewer.net/,Feel evening bit beat will.,47150,3876,824
128,Instagram,2025-07-16,https://www.ramirez-hunter.com/,Research social raise teacher.,50333,4629,2281
233,Instagram,2025-05-12,http://www.kelly.net/,Through figure check social memory bill.,108787,6004,3782
299,YouTube,2025-07-05,https://russell.com/,Bad character area director consider.,53429,4641,1164
153,Instagram,2025-05-16,https://www.hoffman.org/,Middle feeling other president see.,195481,21854,6260
184,Twitter,2025-07-07,http://hayes-vaughn.info/,Southern suffer occur work tree.,134614,7961,2852
145,Twitter,2025-06-04,https://williams.com/,Month policy campaign able guy form.,101640,7174,1827
239,Instagram,2025-04-28,http://ruiz.com/,Cultural generation else outside management picture.,85962,15705,2667
180,YouTube,2025-04-29,http://burke-stevenson.com/,Wait guy might.,100358,14513,4223
146,Instagram,2025-05-04,https://green.com/,Central letter reason care.,192530,32581,9544
187,Twitter,2025-06-29,http://www.garcia.com/,Fast whose its time care.,105857,17708,2579
293,Instagram,2025-05-25,https://hunter.info/,Senior pretty bar huge particularly suggest company.,117633,15489,3456
52,Instagram,2025-05-16,http://williams-price.net/,Activity base project deal see gas.,67714,12655,2037
82,YouTube,2025-04-30,http://strong.biz/,Stuff know yeah shake kitchen.,17771,1923,305
182,Instagram,2025-05-03,https://www.drake-figueroa.com/,Against bad career.,74140,7253,1390
299,YouTube,2025-05-14,http://www.martinez.net/,Computer set gun cold order generation soldier.,55543,10240,2285
77,YouTube,2025-05-14,http://west-murphy.info/,Interesting need determine practice.,16488,969,818
2,Instagram,2025-06-29,https://martin.com/,Rate work necessary forget detail sea.,85978,11126,3497
259,Instagram,2025-07-14,http://graham-jones.com/,Several lawyer participant measure meet.,15632,3125,765
165,YouTube,2025-05-04,http://www.lucas.biz/,Middle sign reflect draw him.,2614,169,94
45,Instagram,2025-05-08,https://www.olson.org/,Easy rock evening chair car wait mouth.,22269,2003,949
92,Twitter,2025-07-15,https://banks.com/,Policy today modern too.,141321,26510,1729
54,Twitter,2025-07-14,http://smith.com/,Anything quite task beat picture today.,187494,37397,3520
8,Instagram,2025-06-29,http://www.gonzalez.net/,Other field ahead sort.,77487,13713,3246
231,YouTube,2025-05-17,https://williamson.net/,Specific left wear own positive describe.,91226,9416,3974
152,Instagram,2025-07-10,http://duran.net/,There simply recently among.,89378,15800,1523
8,Instagram,2025-06-16,https://www.douglas.org/,Hope indeed history option trade pull.,101235,14059,4277
275,Twitter,2025-06-24,http://www.reeves-castillo.com/,Military bar simple across owner tax yourself.,62931,9731,2930
43,Twitter,2025-05-24,https://webb.com/,One military road certainly area.,43856,2378,1667
39,Twitter,2025-06-28,https://www.franklin.com/,Fish we environmental person attack fast serious use.,33728,6480,1097
157,Twitter,2025-05-30,https://lam.biz/,Far smile under hope public.,86349,11611,1513
117,YouTube,2025-04-24,https://randolph.com/,Middle east away newspaper few dream along.,35641,7064,1613
236,Instagram,2025-07-02,https://jordan.org/,Take girl main energy.,120186,14883,2687
101,YouTube,2025-06-13,https://morris-avila.com/,Hundred seem under audience our everything.,92531,11433,1259
243,Twitter,2025-07-11,http://www.white-williams.com/,Keep others price without spend even different.,61674,5235,1156
38,YouTube,2025-05-27,https://www.barry.com/,Not manage close however sea word.,80507,10382,807
262,YouTube,2025-07-03,https://gomez.net/,Change treatment finally.,39915,7491,720
230,YouTube,2025-06-16,http://www.bailey.com/,West game coach international.,140031,9742,5416
134,Instagram,2025-06-03,https://perez-cervantes.com/,Pm follow see avoid rate amount.,43270,8126,1893
252,Instagram,2025-05-24,http://brown.com/,Near level forward resource.,124916,12309,1358
166,Instagram,2025-05-04,https://bowman.com/,Station culture statement forget time.,95996,13246,4481
252,Instagram,2025-06-30,https://www.montgomery-martinez.com/,Fish easy phone.,78269,13004,3432
84,Instagram,2025-07-06,https://www.solis-fernandez.com/,Husband face cell audience market.,9002,1612,435
116,Twitter,2025-07-18,http://www.williams.com/,Sea tend foreign.,4285,454,204
248,Instagram,2025-07-16,https://aguirre-williams.info/,Light one when official stand this store president.,66123,7229,928
196,Instagram,2025-07-03,https://www.holder.com/,General often bank ball environmental sense.,102169,9733,1579
79,Twitter,2025-07-14,http://spencer-logan.biz/,Member cover modern every he top.,4955,364,237
45,Instagram,2025-06-10,https://anderson.org/,Which decide drive financial.,33760,5697,1634
48,Instagram,2025-05-09,https://hernandez.com/,Camera only performance generation hospital capital.,65095,9593,1104
264,Twitter,2025-06-22,http://www.herrera.biz/,Bag name garden week factor another.,34959,6827,1319
151,Instagram,2025-07-03,http://www.mccoy.com/,Technology officer main reason whom after over.,186998,35403,7756
203,Instagram,2025-05-26,http://www.robertson.com/,Member open prove open girl.,23955,1999,803
285,YouTube,2025-06-29,http://www.krueger.com/,Reduce catch explain ahead happen share.,11616,886,258
196,Instagram,2025-06-29,https://edwards.org/,Vote hotel tonight huge character popular best.,37552,5755,566
52,Instagram,2025-05-29,https://black-jones.com/,Nor if view trouble character finally.,153206,24409,7346
131,Instagram,2025-06-13,http://www.moore.com/,Pm later other sometimes structure.,112763,21684,2893
197,Instagram,2025-06-18,http://love-pittman.com/,Somebody customer magazine even civil.,51345,10224,2495
13,Twitter,2025-05-12,http://griffin-richardson.com/,Realize out moment explain discover man.,196785,10795,6709
148,YouTube,2025-07-03,https://www.noble.com/,Certain eye parent water Congress senior make hospital.,84649,15927,4122
43,Twitter,2025-05-20,http://garcia-wagner.net/,Finally begin sing clear support nearly several.,30040,2497,979
68,Instagram,2025-05-29,https://www.hughes.com/,Law culture staff personal many address.,26043,4961,406
36,YouTube,2025-07-10,http://www.curtis.com/,Carry church science air home those read.,199162,32224,3887
188,YouTube,2025-05-06,http://www.brown.com/,News another stuff dog yes whether drug.,24206,4777,404
202,YouTube,2025-05-21,http://vega-pittman.com/,Involve account think meeting teach.,179236,32763,2428
37,YouTube,2025-05-06,http://meyer-johnson.com/,Majority before name different.,53481,8361,1902
300,Twitter,2025-07-08,https://www.trujillo.com/,American sell they admit note.,18687,3419,520
10,YouTube,2025-05-17,http://taylor.net/,Product kid off.,90046,8084,1799
54,Twitter,2025-05-06,http://walsh.com/,Tree produce great doctor.,182571,10985,3700
256,Twitter,2025-05-12,http://www.greene-mitchell.com/,Science partner nature area.,53668,3553,539
63,YouTube,2025-07-14,http://www.vargas-valenzuela.org/,Give mention difference management rate system protect but.,76203,8221,2995
176,YouTube,2025-05-06,https://www.salazar.org/,Themselves poor physical party large.,14986,2927,680
53,YouTube,2025-06-02,https://www.harris.org/,Form recognize expect among.,10878,1348,273
138,YouTube,2025-06-28,http://www.white-woods.com/,Else despite enough home difficult wear.,119011,15697,1672
97,Instagram,2025-06-15,https://www.gillespie.com/,Air authority few process himself size her.,111245,13563,4957
27,Instagram,2025-05-26,https://romero.biz/,Conference stuff have view million nor.,56677,8368,2124
168,Instagram,2025-06-10,http://www.greene-miles.com/,Student determine attention power.,147780,10994,1913
6,YouTube,2025-06-05,http://sims-rodriguez.com/,Require his Republican beautiful natural mean.,87866,15540,1915
102,Instagram,2025-05-26,https://www.mcknight.info/,Perform situation team mind Democrat kind he.,153310,14994,7369
130,YouTube,2025-07-06,https://www.jones.biz/,Former number should vote after job better.,55604,3399,934
117,YouTube,2025-07-17,https://dodson.net/,Personal us turn rule piece trouble.,28915,3074,1135
53,YouTube,2025-05-17,https://www.esparza.com/,Nation budget control several phone spend religious.,14722,1944,676
96,YouTube,2025-05-15,https://mendoza.com/,Provide enjoy cup prepare.,6054,387,204
21,Instagram,2025-05-12,https://ray.org/,Hospital nice reflect.,79527,11296,2330
141,Instagram,2025-04-27,http://cain-cox.com/,Far beat card room your when.,24593,1343,1173
166,Instagram,2025-05-04,http://guzman-campbell.com/,Share after sister series they special.,73220,5473,3338
178,Twitter,2025-05-25,http://turner.com/,Strong chair carry growth pressure assume.,22220,1634,312
271,Instagram,2025-04-30,http://www.phillips.com/,Drop particular current.,54693,4420,962
293,Instagram,2025-07-14,https://www.jackson-briggs.com/,Believe party loss development.,100059,15467,3890
78,YouTube,2025-05-08,https://www.saunders.biz/,Fact affect team push.,65555,10455,1351
184,Twitter,2025-06-12,http://www.cervantes-adams.com/,Send remain address number theory behavior.,129859,11976,2532
188,YouTube,2025-07-18,https://molina-campbell.com/,Nice page law season particularly professor degree.,22173,1273,728
290,Twitter,2025-07-11,http://www.reid-gray.com/,Music hotel team prepare.,35343,6219,570
67,Instagram,2025-06-15,https://garcia-cox.com/,Edge different position that.,9704,1010,263
88,Instagram,2025-06-06,http://www.white-king.net/,Size clear because range determine never talk.,60559,5703,2209
270,YouTube,2025-05-04,https://www.anderson.com/,Compare drug teacher idea morning American.,53949,7554,970
26,Twitter,2025-07-01,http://www.lyons-fisher.info/,They reduce onto someone call attention week.,47871,2578,805
279,Instagram,2025-07-09,https://dixon.com/,Near weight serious site.,42426,3978,563
5,Twitter,2025-04-26,https://www.ortiz-barnes.com/,Sister long else current soldier.,38692,6831,864
122,YouTube,2025-06-19,https://collins.net/,During over improve type effect hotel ten.,21987,2410,650
277,Twitter,2025-05-07,http://watts.com/,Everyone authority glass show fear matter anyone.,140798,21000,1921
