influencer_id,platform,date,url,caption,reach,likes,comments
143,Twitter,2025-07-10,https://www.gentry.net/,Order leader woman.,52945,9265,1586
221,Twitter,2025-05-05,https://graham-farley.biz/,Too carry any now lot cold participant.,167472,24817,6262
31,Twitter,2025-07-21,http://www.key.com/,Might might of history check imagine particular grow.,42559,3770,1824
249,YouTube,2025-05-01,https://mcgrath.com/,Class feeling discover east guess.,67735,13206,2415
284,Instagram,2025-06-22,http://marshall.com/,Simple song table possible.,186793,23085,3124
211,Twitter,2025-06-22,https://www.brown-clark.net/,Economic stay look we production.,103150,17457,1729
262,YouTube,2025-05-18,https://www.richards-bridges.com/,Edge already which impact fill science try base.,33188,5245,980
9,Instagram,2025-06-29,https://williams-hill.info/,Fact star source much painting.,149826,28097,4747
212,Twitter,2025-05-11,https://barnett.biz/,Range water I college.,105417,15419,1301
73,YouTube,2025-05-15,https://www.miller-henson.com/,Glass account above about south.,22852,1258,1002
4,Instagram,2025-06-16,https://huang.com/,Per energy young into parent great capital data.,56245,10786,2065
289,Instagram,2025-05-14,http://www.graves.info/,Charge leave painting green pressure cost.,166841,27470,4420
287,YouTube,2025-05-16,https://cline-keller.com/,Government decision scientist trip decision land.,77289,13632,1488
86,Twitter,2025-06-25,https://robinson.com/,Present act girl history start whether carry.,16519,2578,171
15,Instagram,2025-05-21,http://www.williams.com/,Three space yard involve suddenly.,12476,1570,311
180,YouTube,2025-07-11,http://miller-stone.com/,High moment top especially foreign drug.,118942,16970,4361
287,YouTube,2025-07-01,https://taylor-collins.com/,Trip account general herself.,79791,11368,2340
60,Instagram,2025-06-29,http://brown.info/,Same chair including poor.,120318,14820,1235
281,YouTube,2025-06-21,http://miller-norman.com/,Another often education be reveal.,125281,16630,1312
218,YouTube,2025-06-08,https://www.hernandez.com/,Lawyer so brother kid.,183802,23786,3857
289,Instagram,2025-06-03,http://www.gutierrez.org/,Occur expect two project.,111086,21841,1187
98,YouTube,2025-06-21,http://adams-lewis.com/,Attention full loss court side guess expert even.,127613,21946,4716
296,Instagram,2025-05-06,https://www.anderson.net/,Ok above issue teacher sound man pick.,11495,1964,533
224,Twitter,2025-07-13,http://bass.com/,Action not quality be.,132004,8719,1828
64,Twitter,2025-07-18,https://www.miles-perry.com/,Red simply few those choose down.,44630,3228,788
227,Instagram,2025-05-21,https://www.watkins.info/,Another instead serious those series big morning.,45528,5871,1939
265,Twitter,2025-06-12,http://washington.com/,Situation ready everything type reduce campaign.,28830,2597,746
271,Instagram,2025-05-28,https://barker.com/,Visit measure source benefit know organization whose.,111975,11864,2938
86,Twitter,2025-05-11,https://jones.com/,Best figure rate think point stage.,13475,1815,668
96,YouTube,2025-06-29,https://wells-hall.biz/,Allow enjoy animal reveal court choose chair at.,2481,208,92
291,Twitter,2025-05-29,http://hall.com/,Billion fund century stay.,9501,1683,343
41,Twitter,2025-05-04,https://moore.info/,Run teacher peace capital.,43338,7745,1750
92,Twitter,2025-05-21,https://www.jones-weeks.com/,Way thought possible create situation table.,77792,4980,1958
145,Twitter,2025-05-22,http://hubbard.com/,Town maintain discover billion fear series.,117817,15658,1442
39,Twitter,2025-06-04,http://www.owens.com/,Peace red picture discussion contain brother.,82870,4260,1396
15,Instagram,2025-07-04,https://kline.com/,Yard source individual part officer almost catch.,10270,1283,280
6,YouTube,2025-06-19,https://www.donaldson-wood.com/,Turn news property prevent black start win.,119593,20050,3902
273,YouTube,2025-06-06,https://www.moore.com/,Player author might address resource quite.,94310,16852,1302
6,YouTube,2025-06-26,http://www.hernandez-smith.com/,Chance human war always magazine.,98203,12690,1149
188,YouTube,2025-06-03,http://www.wagner.com/,Owner common forget thing letter cold attack interest.,25732,2102,1150
201,Twitter,2025-06-05,https://nolan.com/,Suddenly deep sort computer.,43807,8022,1271
189,YouTube,2025-05-07,https://hicks.com/,Way state goal beyond.,114907,6547,1490
25,Twitter,2025-05-30,https://lynch-day.biz/,Man coach wide ball.,73088,13801,3360
193,Twitter,2025-06-04,https://www.miller.info/,Degree where ten maintain because PM and.,49482,6656,559
210,Instagram,2025-05-24,http://larson.net/,Fish miss great organization media.,15510,2936,350
130,YouTube,2025-07-14,https://reeves.org/,Pull few parent move big nature.,143513,27873,4805
57,YouTube,2025-06-16,https://baker.com/,Rather order fine.,90365,14714,3479
17,YouTube,2025-04-30,https://cardenas-reed.com/,Line have foot fly activity.,73839,8103,965
162,YouTube,2025-06-10,https://stafford.net/,Especially area my.,149833,11142,2939
110,Twitter,2025-06-27,https://www.hopkins-perez.com/,Building table these billion.,89924,15754,2299
234,YouTube,2025-05-07,https://petty.com/,Oil plan around attention station.,60605,11180,1410
164,Instagram,2025-05-21,http://www.johnson.info/,Probably film price time people.,86726,14165,1352
248,Instagram,2025-06-06,http://www.garcia.biz/,Drive door news.,34342,6809,1338
125,Twitter,2025-06-12,https://boone.com/,Debate other management water coach.,108263,13545,5301
232,Instagram,2025-05-21,https://www.norton.biz/,Final answer present.,81627,4738,2243
168,Instagram,2025-06-03,http://henry-myers.com/,Step eat upon rather.,183535,32265,4335
262,YouTube,2025-07-04,https://www.lewis.com/,Increase Mrs possible democratic hour.,16339,2701,787
217,Twitter,2025-05-08,https://barber.com/,Partner buy mission.,66151,7243,2708
235,YouTube,2025-06-01,https://www.jones-king.info/,Guy science performance common do until.,18585,1011,389
176,YouTube,2025-06-10,http://mckinney.info/,Speak street evidence edge.,50909,10125,1508
50,Instagram,2025-06-27,https://mathis-fuller.com/,Past clearly reality minute.,50224,5191,2392
226,Instagram,2025-05-02,https://hayes.net/,Talk these prove use say situation stand peace.,48648,5583,1809
183,YouTube,2025-07-08,https://www.solis-johnston.com/,Audience population democratic that.,60913,9082,817
125,Twitter,2025-05-10,https://donaldson-nelson.net/,Project two protect sell like.,92965,13274,3897
270,YouTube,2025-05-14,https://www.ortiz.com/,Rate song type across born.,33234,5216,441
121,YouTube,2025-05-22,http://www.browning.com/,Range somebody his according.,116689,8533,4488
245,Twitter,2025-07-12,http://rowland.com/,Machine in notice relate wish.,43701,6340,1729
90,Instagram,2025-06-12,http://www.fowler.com/,Million occur town yard word actually.,32310,3150,460
218,YouTube,2025-04-27,http://www.moss-gray.com/,Purpose though approach site politics population each.,159584,8103,3563
3,Instagram,2025-05-15,https://www.gonzales.com/,Hope success son hard.,114286,11884,2376
279,Instagram,2025-06-20,https://hicks.com/,Eat responsibility occur nation necessary.,69216,4836,1210
64,Twitter,2025-05-23,http://www.rivera.net/,His present affect tough impact school green.,69360,8137,2232
203,Instagram,2025-05-19,http://www.rodgers.com/,Service morning between challenge sea heart drug.,35620,3961,393
17,YouTube,2025-04-29,https://turner-davis.info/,Production nothing involve note front.,57990,5978,795
284,Instagram,2025-06-21,http://rangel-blackburn.biz/,Trouble ahead half happen effort.,119324,16670,2741
119,Instagram,2025-05-11,https://www.reid-lewis.biz/,Head allow full carry often.,51145,5512,1108
204,YouTube,2025-07-17,https://jones-adams.com/,Particularly woman another reveal first yard factor beautiful.,93792,10145,1255
20,Twitter,2025-06-01,https://www.silva.info/,Congress billion success address.,50983,9440,2355
145,Twitter,2025-06-04,http://www.ruiz.com/,Look window authority hand.,47849,9413,1573
36,YouTube,2025-07-02,http://beasley.com/,Around bit price situation into leg.,122404,9233,3088
186,Twitter,2025-06-18,http://www.moore-rodriguez.com/,Red view stop benefit compare member action.,58313,4130,1285
69,Instagram,2025-06-26,http://www.burke.org/,Choice particular color assume.,21577,2674,270
267,Instagram,2025-07-07,http://preston.com/,Statement none state.,206916,23837,5554
113,YouTube,2025-06-13,http://www.nelson.com/,Dream structure deep spend fish stage she.,67700,8302,885
145,Twitter,2025-07-07,https://crawford-ramirez.info/,Mother opportunity risk speak.,87063,7640,1729
226,Instagram,2025-05-01,http://hayes-atkins.biz/,Great wife scientist place player for church.,122274,17577,4127
219,YouTube,2025-06-11,http://frazier.com/,Yet still let sort she.,38585,3061,550
292,Instagram,2025-07-08,https://www.edwards.com/,Discuss decision before mind travel.,4278,409,205
254,YouTube,2025-05-16,https://www.garza-peterson.biz/,Daughter painting thank budget ago accept.,51112,5102,1779
156,YouTube,2025-05-20,https://austin-castillo.com/,Within increase name only.,57339,9782,1329
222,Instagram,2025-07-04,http://www.fisher.biz/,Sound special within three six task.,79849,8001,3403
175,YouTube,2025-05-22,http://taylor-ward.com/,School add set.,152096,27213,7447
222,Instagram,2025-05-06,http://farley.com/,Media rise front page ok front.,121282,8540,2768
154,Twitter,2025-06-30,http://horton.com/,Lead business executive scientist not ten much.,32236,6192,581
282,Twitter,2025-05-15,https://delgado.com/,Range close hand key.,26759,2599,1300
73,YouTube,2025-07-06,http://graham-clark.info/,Top perform himself until type recognize.,27579,5386,597
297,Twitter,2025-07-09,https://green.com/,Glass stage society specific receive whether surface when.,164871,25430,4886
31,Twitter,2025-07-09,http://www.wise-norris.com/,Service interest worker professional leader interest.,77860,10618,1533
17,YouTube,2025-05-25,http://www.floyd-lewis.biz/,Recent heart American race game consider.,40504,4309,1727
118,Instagram,2025-07-10,https://brooks-davis.info/,The study each Mrs.,119645,13034,1741
44,Twitter,2025-06-10,http://www.wilson-brennan.com/,Painting speak serious nice.,40590,5462,1367
73,YouTube,2025-05-07,http://harris.com/,High material explain I.,28866,3805,1075
263,YouTube,2025-05-06,https://foster.com/,Sister leave order perhaps.,106766,14148,5137
6,YouTube,2025-05-18,https://castillo.com/,Her never fill simple push.,84772,10108,3249
294,Instagram,2025-06-12,https://martinez.org/,So situation film yet budget.,130137,15065,2817
15,Instagram,2025-05-03,https://www.freeman.biz/,Space imagine really rise office describe.,11507,1771,492
234,YouTube,2025-05-03,https://www.romero.com/,Table than among result able wonder.,62329,10555,1643
285,YouTube,2025-06-02,https://www.banks-jackson.com/,Computer instead bad executive even involve figure.,10699,1336,378
263,YouTube,2025-05-03,http://www.davis.com/,Carry song member.,94207,8130,3424
289,Instagram,2025-07-20,https://www.torres.com/,Know against hear himself.,86534,13610,3596
218,YouTube,2025-06-15,https://thomas.com/,Green son whatever star body take prepare.,185976,11362,9229
182,Instagram,2025-05-30,https://brown-underwood.com/,This authority history less memory painting may us.,59915,7302,1559
122,YouTube,2025-05-03,http://barry.com/,Begin yourself network blue two to miss.,32611,4108,1526
192,Instagram,2025-05-31,https://www.ellis-copeland.com/,Result growth benefit sister early.,6735,1035,213
268,Instagram,2025-07-06,https://www.bridges.com/,Structure human his article.,37754,6365,920
4,Instagram,2025-06-25,http://martinez.info/,Way month support possible model forward.,35280,6502,1110
217,Twitter,2025-05-19,https://www.dalton.com/,Discover gun offer occur month some work market.,46618,6793,624
45,Instagram,2025-06-20,https://www.moore-hampton.com/,Popular image production answer nice.,19787,3271,718
291,Twitter,2025-07-10,http://johnson.com/,A establish million father maintain sport even.,9142,943,328
169,YouTube,2025-07-06,https://campbell.net/,Participant player a happen decade.,65628,3717,3238
74,YouTube,2025-06-04,http://www.elliott-hayden.com/,Happen small news test own better marriage.,40480,6137,1051
57,YouTube,2025-05-26,http://www.gonzales.com/,New them involve argue soon.,112175,18273,5454
130,YouTube,2025-05-01,http://www.meadows.net/,Speech interesting main large name.,111809,12809,1165
233,Instagram,2025-07-11,http://hahn-sanchez.com/,Officer discover development travel may herself stage.,117282,10415,3568
107,Twitter,2025-06-14,https://wells.biz/,Century painting structure job new.,66372,8483,2204
207,YouTube,2025-06-28,http://munoz-garcia.com/,Establish guess interview quite economic specific.,158733,21632,4417
202,YouTube,2025-07-06,http://www.burton-gonzalez.com/,Discussion per human nature wall kind challenge heart.,187017,20323,7647
67,Instagram,2025-07-12,http://martinez.com/,Standard paper onto entire career defense.,21428,2963,643
259,Instagram,2025-06-13,https://www.smith.net/,Build week thank today cold prove.,42661,4340,468
244,Twitter,2025-05-02,https://martin.net/,Away budget including.,6232,409,166
185,Instagram,2025-05-19,https://kim-krueger.com/,Day state on finally deal.,42464,8249,621
277,Twitter,2025-05-10,https://www.wallace-nguyen.com/,Behavior food send local.,120056,22942,1880
95,Twitter,2025-06-17,https://www.reeves.com/,Radio second ask.,17445,1688,492
120,YouTube,2025-05-30,http://young-davis.com/,Heavy event listen sea high.,62461,5061,1831
165,YouTube,2025-06-24,http://www.richardson.biz/,Magazine recognize of.,7318,888,201
106,Twitter,2025-05-06,http://bauer.com/,Political central determine.,38359,5927,872
56,Instagram,2025-05-06,http://www.jones.com/,Doctor save management thus against quality boy.,28811,2738,1221
230,YouTube,2025-05-18,http://www.cruz.com/,Leave prove get.,180887,12166,7953
253,YouTube,2025-05-03,https://www.meadows.net/,State third practice decide wonder bring break.,148286,21827,5499
39,Twitter,2025-06-22,http://www.roman.biz/,Close though today night environmental.,81464,6081,4020
5,Twitter,2025-06-17,https://www.parks-bailey.info/,Suggest can beautiful treatment energy far.,117107,10139,1988
137,Twitter,2025-07-20,http://peck-williams.com/,Forward gas summer recently discussion world act.,38763,2869,1255
139,Twitter,2025-05-03,https://www.smith.org/,Home company stuff research themselves.,77317,14981,1490
49,Twitter,2025-05-13,http://west-adams.com/,Interview nearly believe sea of.,8437,934,146
162,YouTube,2025-05-25,https://www.herrera-acosta.biz/,Town three design issue because eight.,93761,13695,2558
123,Twitter,2025-05-18,http://www.gibson.com/,Board beat speech far political organization late office.,74225,4036,2565
244,Twitter,2025-07-07,http://www.alexander.com/,Organization want popular allow make stuff system.,16265,1294,547
159,Twitter,2025-07-15,http://www.cooper-bright.com/,Follow here film economic mouth crime outside.,52424,5678,2002
184,Twitter,2025-06-14,https://www.powell-jones.org/,Why fly guess small.,123020,9948,4932
22,Instagram,2025-07-18,https://www.gonzalez.com/,Better can arrive huge marriage none media.,29391,5034,367
106,Twitter,2025-06-26,http://www.wells.biz/,Cause what probably culture bit everyone voice.,61496,4013,2759
86,Twitter,2025-06-01,http://clark-savage.info/,Study reality easy state.,5990,467,138
299,YouTube,2025-06-11,https://www.torres-holmes.com/,Man eight sea possible radio.,71221,8449,1459
136,Instagram,2025-05-18,http://www.lloyd-floyd.net/,Degree bad common third.,44160,7922,1373
151,Instagram,2025-07-08,https://www.collins-wood.org/,Community throw popular maybe collection coach.,204321,29803,6922
26,Twitter,2025-04-27,http://www.bell.org/,Animal Republican message college although son artist.,52065,7377,1743
141,Instagram,2025-05-25,http://hale-gomez.info/,Something reason explain top look out together.,17680,1806,774
124,Instagram,2025-07-06,https://brown.com/,Everyone dream quite son clear general after.,40815,5820,1736
266,YouTube,2025-05-01,https://www.arnold.com/,Full but understand study open technology.,77831,12133,1704
212,Twitter,2025-04-25,https://mack-dillon.net/,Western no thank finish various shoulder industry only.,100966,14354,1351
169,YouTube,2025-06-03,http://graham.com/,Big student respond.,185536,13004,2730
248,Instagram,2025-04-23,http://vaughan-gibson.com/,Remember measure open realize site.,55275,5295,957
17,YouTube,2025-05-01,https://www.jones.com/,Deal issue radio citizen design design practice.,54505,8394,1658
252,Instagram,2025-06-05,http://sanchez-berger.com/,Should section west sing chair former.,142982,16119,2218
195,Twitter,2025-07-21,http://www.pineda.com/,What future little network.,36223,3896,631
116,Twitter,2025-05-01,http://miller.org/,Right here represent.,7562,1098,285
216,YouTube,2025-05-29,http://www.williams.com/,Food pick reason guess hair.,5165,758,258
37,YouTube,2025-05-06,http://www.mason.com/,Goal family throw gun girl manager.,41447,5522,1226
228,Twitter,2025-06-03,https://www.morgan-lewis.com/,True almost require quality beat apply.,94229,6694,2127
241,Twitter,2025-05-02,https://www.wilson.com/,Face very cost they.,124126,14603,1507
223,YouTube,2025-05-06,http://castillo.biz/,Kitchen young participant two.,56602,5878,587
164,Instagram,2025-05-11,https://martin-harmon.info/,Treatment guess share man high student top.,98512,6943,4197
232,Instagram,2025-05-04,http://benson.net/,Country research reason out start newspaper yourself.,66540,12946,2010
269,Twitter,2025-06-10,http://www.pearson.com/,Arrive bring case pressure community low.,154980,19255,5794
260,Instagram,2025-07-03,http://www.miles.com/,Quite enjoy story director us.,77941,8756,3397
241,Twitter,2025-06-30,https://www.jordan-newman.biz/,Read money movie carry step.,180924,22308,2407
239,Instagram,2025-06-14,https://www.sanchez-brown.org/,Much pay state.,108793,5943,4399
96,YouTube,2025-07-07,http://gallegos.com/,Kitchen deep street successful stock.,3891,365,81
256,Twitter,2025-06-03,https://small.com/,Education newspaper their figure respond wear difference can.,82415,10766,1378
33,YouTube,2025-06-13,http://www.peters.com/,Performance range while before boy family.,79192,9392,3143
175,YouTube,2025-06-19,http://garza.com/,Particular maintain issue morning husband.,100977,16649,3230
113,YouTube,2025-06-04,http://robinson.com/,Hit TV source look line break later.,76559,5128,1115
130,YouTube,2025-05-14,http://jones.com/,Both reduce federal every western.,59224,9846,2542
117,YouTube,2025-04-27,http://mayer-walsh.com/,Home let market property.,17143,1800,735
134,Instagram,2025-05-12,https://www.golden.com/,Deep away create buy meet rise.,93461,5256,3622
80,Twitter,2025-06-03,http://www.palmer.org/,Water office threat majority player major let.,36932,4873,1831
138,YouTube,2025-06-18,https://garcia.com/,Environmental economic law civil.,55583,3633,2401
147,YouTube,2025-06-02,https://case.com/,Believe way boy step outside respond option.,46057,7493,1009
236,Instagram,2025-05-05,https://horton.com/,Happen hold agent for.,88427,17676,2475
91,Instagram,2025-07-19,https://fields.com/,Need along there than own.,36012,3683,1536
1,Instagram,2025-07-06,http://www.hines.com/,Yeah including available charge size.,63274,7330,3148
64,Twitter,2025-05-30,https://mendoza.com/,Person fly send west.,100265,16678,1952
58,Instagram,2025-07-15,https://www.ryan.com/,Drug capital that me though bank join.,130465,22388,4372
234,YouTube,2025-06-18,https://www.ramirez.com/,Win open democratic.,97187,9970,3734
183,YouTube,2025-07-03,https://www.cummings.net/,Production development happen theory surface.,57428,8322,955
90,Instagram,2025-06-11,http://www.banks.com/,Believe deep consider particular per.,30099,2133,549
110,Twitter,2025-05-22,https://www.nelson.biz/,Less country significant executive.,84825,6874,1049
109,Twitter,2025-07-06,https://hall.com/,Century certainly also say kind.,23074,2367,490
55,Twitter,2025-06-18,http://sloan.net/,Blue leg free black PM.,109395,14310,2510
34,Twitter,2025-05-16,http://www.dixon.net/,Education tree fill statement bed approach it prepare.,4991,776,107
282,Twitter,2025-06-24,http://hicks.org/,Table professional partner grow major.,23482,2115,1040
126,Instagram,2025-06-02,https://ortiz.com/,Under us moment young.,10111,2000,375
99,Instagram,2025-07-08,https://lopez.info/,Yard speak produce same alone same realize well.,133940,8610,6497
118,Instagram,2025-05-15,http://hernandez.org/,Itself music increase him them.,57876,9714,2705
175,YouTube,2025-07-17,https://mccoy.org/,List left front near turn let close hand.,102892,20462,4597
197,Instagram,2025-06-11,http://rollins-terrell.com/,Operation leader ground official trial turn.,59477,4105,2655
70,YouTube,2025-06-12,http://hernandez.com/,Nation street per agree time often read.,186124,16276,7157
174,Instagram,2025-07-03,https://www.fitzpatrick.com/,Power claim get meet either mean.,59951,10447,2425
143,Twitter,2025-05-22,http://www.taylor.biz/,Leg your effort ask election.,32114,4863,949
256,Twitter,2025-04-27,https://orozco-wright.com/,Car each role network black next out.,45883,6268,952
162,YouTube,2025-07-18,https://www.campbell-duffy.com/,Try mission clearly raise international benefit baby win.,95440,10702,2679
27,Instagram,2025-06-10,https://www.jimenez.com/,Star seem may wall power best serious.,87062,12627,3935
117,YouTube,2025-06-20,http://mcfarland-collier.com/,Try black capital end heart agree similar.,21854,1397,669
15,Instagram,2025-05-16,http://fisher.com/,Reality morning know customer series letter.,9081,833,430
286,Twitter,2025-07-05,https://www.lopez.com/,Event amount against everyone second.,70937,7473,3405
91,Instagram,2025-07-05,http://kidd-smith.net/,Exist show attack expert.,43940,4354,443
283,YouTube,2025-04-29,https://williams.org/,Night decade true effort forward song.,198240,32931,7792
34,Twitter,2025-07-12,https://www.fuller.net/,Listen then change board.,6934,1106,196
111,YouTube,2025-04-23,https://thompson.info/,Late economic find bad.,23652,3538,575
59,Instagram,2025-05-27,https://www.carter-lynch.com/,Enter long camera ready center teach father.,141688,8430,4445
230,YouTube,2025-07-02,http://www.young.net/,Weight heart evidence future human third.,121467,10042,3302
58,Instagram,2025-05-19,https://barnes.com/,Can kid forward responsibility mean class cell.,57784,4725,1198
1,Instagram,2025-07-15,https://scott-clark.com/,Ok bring by long contain visit.,99668,17367,2343
102,Instagram,2025-06-23,http://scott-white.com/,Rather community theory.,136383,18642,4452
33,YouTube,2025-06-23,https://brown.net/,Staff maybe finish ago pretty return add.,102907,12637,2443
5,Twitter,2025-04-28,http://www.campbell-cantu.com/,There until do amount yet contain lead.,66944,10201,799
132,Twitter,2025-07-03,https://collins.com/,According table able common cup.,201741,13100,8343
43,Twitter,2025-06-10,https://moore.com/,General way chair live follow.,56838,6760,850
60,Instagram,2025-07-07,http://www.cunningham.com/,Until necessary book town attorney.,51836,9260,1433
276,YouTube,2025-05-26,https://gonzales.biz/,Option explain suddenly attack sea writer able.,124932,6259,6036
186,Twitter,2025-07-03,https://www.jefferson.info/,Style discuss time.,119659,9614,4492
166,Instagram,2025-04-23,https://mitchell-johnson.com/,Contain gun company perhaps test.,61642,4301,2219
107,Twitter,2025-05-15,http://johnson.net/,Far along gas tree full plant.,95566,7057,4521
250,YouTube,2025-05-02,http://garcia.com/,Expect public Mr process.,115143,10489,4166
263,YouTube,2025-07-21,http://floyd-jackson.info/,Nothing left program.,104481,9148,2598
255,Twitter,2025-06-04,https://www.martin.net/,Senior door reality economic.,33594,6234,558
255,Twitter,2025-06-20,https://green.org/,Leg subject month.,33800,3699,751
203,Instagram,2025-05-28,http://www.guzman.com/,Store question about produce education.,16263,2519,314
4,Instagram,2025-05-21,https://walker-hall.com/,Social doctor amount space huge baby agency energy.,35762,5304,1364
142,Twitter,2025-07-14,https://shaw-spencer.com/,Contain image foot.,155605,7805,4523
229,YouTube,2025-05-29,http://www.murphy.com/,Perform color share under level important man.,21368,1493,407
237,Twitter,2025-05-29,http://www.hebert.net/,Very tree ok personal live drop civil.,79042,12014,819
206,Instagram,2025-06-13,http://campbell.net/,Candidate role Congress Congress quality suggest.,62136,9590,2652
234,YouTube,2025-05-17,https://www.scott-le.com/,Church agreement church history their long wind organization.,44888,8897,1207
276,YouTube,2025-06-17,https://oneill.com/,Blue method above store black major.,105247,7349,1350
79,Twitter,2025-06-30,https://henson.info/,Today tree thus this one argue scientist.,3782,406,148
117,YouTube,2025-06-30,http://english.com/,Among job try.,36807,2405,829
281,YouTube,2025-05-25,http://moore-ramos.net/,Enter cold concern stuff hot town.,82157,14964,1272
86,Twitter,2025-05-13,http://rodriguez.com/,Fill during north part black machine new law.,17513,2907,702
178,Twitter,2025-06-27,http://www.fox.com/,Hospital president job while nor recent officer.,18875,1320,938
99,Instagram,2025-05-05,http://www.horton-atkinson.com/,Technology picture push everyone country perform assume.,141553,10110,4419
232,Instagram,2025-04-30,https://young.com/,After party standard fish.,162921,8353,5865
32,Twitter,2025-06-23,https://bryant.com/,Weight rich push.,115507,13400,4492
69,Instagram,2025-06-21,https://alexander.com/,Begin positive work collection heart.,50574,7293,811
235,YouTube,2025-06-07,https://jones-king.com/,Seek tough few watch process animal attention.,41328,4618,1548
151,Instagram,2025-06-15,http://anderson.com/,Make charge I alone civil choose require.,147354,26375,1984
180,YouTube,2025-04-25,http://www.irwin.com/,Would need leave coach table girl.,55810,3631,2237
170,YouTube,2025-05-13,http://www.miller-miles.com/,Too recent choice itself market.,129273,17896,3278
267,Instagram,2025-05-31,http://www.perez.org/,Teach ten hotel doctor thought.,209564,40757,4731
